Tweet ID,Mis Prob,Counter Mis Prob,Unrelated Prob,Label,Text,Created At,Is Retweet,Language,User ID,User Location,"label (0:misinformation, 1: counter-misinformation, 2: irrelevant)"
1227422690086027264,0.9760508515423112,0.0059627024070949,0.0588141391296625,0,This is the same action that 5G technology uses in pulsed waves and the CORONA VIRUS was reported to have started in an area in China that had rolled out 5G technology! https://t.co/YoupHoihgd,Wed Feb 12 02:42:28 +0000 2020,False,en,1147659756800303109,#WWG1WGA,0
1227566657821794305,0.0088464663272433,0.0057696654817307,0.995595965580161,2,China faces delays in 5G roll-out due to coronavirus - South China Morning Post: China faces delays in 5G roll-out due to coronavirus  South China Morning Post https://t.co/EOYY9CE4Rv https://t.co/FunSvFtjW6,Wed Feb 12 12:14:32 +0000 2020,False,en,39975891,"Toronto, Ontario",2
1227601477918699524,0.0028307978209599,0.0002630829961816,0.9995615984970796,2,China faces delays in 5G roll-out due to coronavirus - https://t.co/jOWKT5ngKJ,Wed Feb 12 14:32:54 +0000 2020,False,en,537569607,Hong Kong-Beijing-Singapore,2
1227580865074515969,0.012752994257501,0.0061718363872721,0.986570622407854,2,#Coronavirus outbreak could delay 5G deployment in India  https://t.co/f4Zkes4MxY https://t.co/5FGhANYHY8,Wed Feb 12 13:11:00 +0000 2020,False,en,36327407,India,2
1227574090237501441,0.0020284202605887,0.0002098324579052,0.9996784611392489,2,China faces delays in 5G roll-out due to coronavirus https://t.co/nibJomvz0Y,Wed Feb 12 12:44:04 +0000 2020,False,en,986750503,Haarlem,2
1227614079042211841,0.2570920158250893,0.5738327876311797,0.0622889656749734,1,"@ProleLumpen @joan_poh @zeroman1985 Once China come out of this, they will be much stronger, install 5g and be able to capture any dickhead who tries to ""plant"" the coronavirus &amp; bird flu rn. My conspiracy gut tells me, reason why US is so scared of 5g is the tech can spot a liar a mile away. US can no longer/1",Wed Feb 12 15:22:59 +0000 2020,False,en,858822569071452162,,1
1227726765188997121,0.9126994251724792,0.0203981351215453,0.1298903663363688,0,CORONA VIRUS CAUSED BY 5G!!!ALERT!!! https://t.co/95dk3IW327 via @YouTube,Wed Feb 12 22:50:45 +0000 2020,False,en,1885578205,,0
1227668562271260674,0.7117095948758836,0.0173141276420493,0.4518248733865226,0,"Coronavirus, 5G, and Earnings Season https://t.co/iJu55ryMW9 harvardbiz #HBR",Wed Feb 12 18:59:28 +0000 2020,False,en,2956809796,Online,2
1227733028568469504,0.9026360400536528,0.0611057547775157,0.0248542472280297,0,The Hidden Link Between the Coronavirus and 5G Testing https://t.co/mibSjoBDQL,Wed Feb 12 23:15:38 +0000 2020,False,en,320252434,,0
1227579415284113408,0.6327000200889736,0.3486695763845262,0.0368901077767562,0,"Overheard at lunch “yeah so that coronavirus thing was patented 2 years ago by the Bill and Melissa Gates foundation. In NY, where they tested 5G. And, y know, 5G tests have caused flu like symptoms. But if you try and post about that on FB, it  won’t let you” No. Words.😳",Wed Feb 12 13:05:14 +0000 2020,False,en,14432184,"Crofton Park, London",0
1227633390524026880,0.1428626558990835,0.0016261916001213,0.9545970100473912,2,"""China faces setback in 5G ambitions as coronavirus leads to delays in base station installations"" - https://t.co/2cPysRJfyg",Wed Feb 12 16:39:43 +0000 2020,False,en,36522819,Prague,2
1227491181187096576,0.8708057783713898,0.0416923254133894,0.0974212198002781,0,I’ve been reading a few posts from ppl I know about how the #CoronavirusOutbreak is because of 5G trials and Wuhan was the place that first rolled this out and therefore is seen to be used as a biologocal warfare weapon... 😬 #coronavirus,Wed Feb 12 07:14:37 +0000 2020,False,en,726809731,Australia & Hong Kong,0
1227709123409711105,0.0068675514094694,0.0755936992059571,0.915220970413995,2,"Mobile World Congress is officially cancelled due to coronavirus fears. While not a space industry conference, a growing number of satcom companies have been attending/following MWC because of the overlap between satellite and 5G. https://t.co/zOcPMxVS8Z",Wed Feb 12 21:40:39 +0000 2020,False,en,793501201354686464,Installation 07,2
1227553393729851392,0.0027793936055403,0.001905442452038,0.9988384236182408,2,China faces delays in 5G roll-out due to coronavirus https://t.co/YJieL02Vb4 via @scmpnews,Wed Feb 12 11:21:50 +0000 2020,False,en,1391041,Brasschaat (BE),2
1227517733920636928,0.9901900823527254,0.0113338554590485,0.0102162548583319,0,People saying that 5g is the cause of coronavirus because Wuhan is where it was being tested. Heard it all now.,Wed Feb 12 09:00:08 +0000 2020,False,en,260422622,London,0
1227542948499329024,0.941849908457244,0.0370126930526433,0.039229465033488,0,You shall NOT use 5G in any of my countries. In China it causes flu like symptoms and this happens. They get carted off as Corona virus victims and killed for body parts!!  https://t.co/rJBkzYQuHw,Wed Feb 12 10:40:20 +0000 2020,False,en,4864864365,,0
1227512697488580608,0.7587433049505378,0.1142953581743005,0.0560721041084867,0,5G radiation symptoms are the EXACT same as the Corona virus. Some country (forgot which sry) banned 5G because it killed their people but china had other plans. Stay woke people this world ain't what you think it is.,Wed Feb 12 08:40:07 +0000 2020,False,en,3302210129,"Bronx, NY & Coruscant ",0
1227424373675565057,0.7634114056843513,0.2458395848971885,0.0070975594312771,0,"Chinese link between 5G &amp; Coronavirus in that human immune system being attacked by 5G Weapons grade Microwave Radiation, is NOT safe &amp; in direct contravention of the Nuremberg code of use, now being directly linked to recent world wide outbreak of Coronavirus &amp; rising death toll https://t.co/P2LHVtSuLe",Wed Feb 12 02:49:09 +0000 2020,False,en,1440598910,"Witham, Essex, England.",0
1224451080269877248,0.0464711345454924,0.8922647918125685,0.0240268622383788,1,"Magnificently bonkers conspiracy theory doing the rounds on Facebook: Coronavirus is a hoax to get people vaccinated, and people in Wuhan are dying from 5G radiation. https://t.co/bh66cZ2XEI",Mon Feb 03 21:54:21 +0000 2020,False,en,2990400792,"Sydney, New South Wales",1
1224464567243280384,0.0322359635546178,0.9253051579397852,0.0944590415204258,1,"I see your anti-vax/anti-5G coronavirus conspiracy and raise you The Simpsons-as-Cassandra, foreshadowing the secret plans of the global elite. No, this guy does not seem to be joking.  https://t.co/rXjzDRV9q6 https://t.co/3ekFmxEADB https://t.co/WJYijXBSwq",Mon Feb 03 22:47:56 +0000 2020,False,en,3003083709,Canberra,1
1224203060257480710,0.1901910438941745,0.0225969083516536,0.8903654445439805,2,"The reason our government moved everyone in quarantine to The Wirral, who could have #coronavirus, is because they’d be much more content with a breakout in the North as opposed to London/South East of England. First allowing Chinese to participate in 5G, then HS2, now this...",Mon Feb 03 05:28:48 +0000 2020,False,en,1216960866106605568,UK,2
1224343044369125376,0.0026902762622876,0.9975198323427203,0.0201215868593521,1,There are some deeply misinformed 5G conspiracy theories out there but this one in my local NextDoor group that tries to link Corona virus to 5G deployment is truly bonkers 🤦‍♂️ https://t.co/PWi8gJQfSH,Mon Feb 03 14:45:03 +0000 2020,False,en,1342285020,Detroit & Boston,1
1224275070970888193,0.2618438897026842,0.3539911605056679,0.4150045618779293,3,@BillGates 201 EVENT? WHAT EXACTLY IS THE PURPOSE OF MONSANTO?  MICROSOFT IS PART OF THE NWO?  BECAUSE YOU DON'T SAY ANYTHING FROM YOUR CORONAVIRUS PATENT... IF YOU ARE TRULY INTERESTED IN HUMANITY I BELIEVE THAT ACTIONS SPEAK STRONGER THAN WORDS...CHINA SAID 5G SOS. https://t.co/vxrnMuuayN,Mon Feb 03 10:14:57 +0000 2020,False,en,505303266,⁂︎ᗰ€᙭𖨆︎¢𖦹︎=𓂀︎⌘︎߷︎۞︎,2
1224129051763400704,0.7946277408257822,0.0185836014207312,0.1101430153432593,0,#microwavesickness #4G #5G #Coronavirus Helping to sicken us.  https://t.co/YFBcB7r3Ac,Mon Feb 03 00:34:43 +0000 2020,False,en,892603884,"Royal City, Te. Infinite Plane",0
1224178724658122752,0.0247323148333854,0.3802848970477688,0.8397554320349505,2,Have you ever seen #capitalism builds a hospital for 1000 patients (with 4/5G WiFi) in 10 days?   cc @steve_hanke @FakeOscarMunoz #Wuhan #coronavirus #China https://t.co/YuJoWSEUnN,Mon Feb 03 03:52:06 +0000 2020,False,en,22161287,The State ,2
1224379405000003584,0.9617675949924008,0.0035306087988244,0.2070541119663424,0,"While the Masses panic over #coronavirus, #5G is depleting their tolerance to EMF. This is what happens : Electromagnetic Being: My EHS (Electromagnetic Hyper sensitivity) Photo A... https://t.co/j2RqNFnGyv",Mon Feb 03 17:09:32 +0000 2020,False,en,466228100,"Lemuria, BC",0
1224402625472483328,0.530949482419937,0.3217518448415594,0.0887621865908694,0,@aye_lass @fantasticmusic wait ... what??!  are you suggesting 5G caused the coronavirus outbreak? do they have evidence?  I started shopping at Aldi at the start of the year ... do you think Aldi caused the coronavirus outbreak too?,Mon Feb 03 18:41:48 +0000 2020,False,en,850088288010588163,"London, United Kingdom",1
1233148300162846722,0.0181952709681343,0.0031988667695448,0.9907912383184032,2,"Chinese telecom operators and internet companies are ramping up efforts to explore new opportunities for 5G promotion, and their efforts will push forward the country's 5G commercialization despite stress caused by COVID-19 epidemic.  https://t.co/w4giHCnQBk",Thu Feb 27 21:54:00 +0000 2020,False,en,700971797374640128,Beijing China ,2
1232930364898697216,0.0428028012000578,0.9740248138453956,0.033732577548382,1,Just now heard someone link #COVID19 to #5G and #microwaves. Seriously? #Science people! Is there any #conspiracy our species won't believe? Maybe we deserve to go extinct.,Thu Feb 27 07:28:00 +0000 2020,False,en,205398186,"Binan, Laguna",1
1233029144507830273,0.8205136983708137,0.0420805677202796,0.0951453652906643,0,@hopecrolius @turnbolt11 1/The 5G network provides the ABILITY to cause COVID-19 symptoms and disease within an emitters range at a time of one's choosing. The mere availability of 5G coverage does NOT necessarily mean SUDDEN explosion of disease. Short term outbreak of COVID-19 disease symptoms CAN,Thu Feb 27 14:00:31 +0000 2020,False,en,87822212,Chicago,0
1233121258075590656,0.9317024285701224,0.0156875531367845,0.0906505602659584,0,Did you know 5G is the cause of the Coronavirus? Look it up. Wuhan was the first city in the world to test 5G right before the “Coronavirus” started spreading,Thu Feb 27 20:06:32 +0000 2020,False,en,909824137194901504,"Buena Park, CA",0
1232890608408240129,0.8904296195272177,0.0388120492794415,0.0606781044576522,0,"@FreedomforceR Just watched a very disturbing video about Coronavirus. Explains why people are just keeling over dead from lack of oxygen. They installed 5G all over the Wuhan area. Causes lack of oxygen, acute respiratory distress. It's not a Virus at all. And they are to install this is US.",Thu Feb 27 04:50:01 +0000 2020,False,en,703738292290887682,United States,0
1233178039741222912,0.9819326982031648,0.0068930482632597,0.0397592400142295,0,More ppl are gonna die from 5G than the Coronavirus,Thu Feb 27 23:52:10 +0000 2020,False,en,870401467626262530,"New Jersey, USA",0
1232958225714036736,0.2164390577868939,0.8272919998014542,0.0151783848433427,1,Full conspiracy news about 5G &amp; corona virus connection in this .... https://t.co/WSLxV2mIh1,Thu Feb 27 09:18:42 +0000 2020,False,en,1060533894242541569,Mumbai India,1
1233126162970423297,0.0431586832009106,0.0129508150382858,0.8694156203821009,2,"Wow!? Wonder why!! 5G Network Rollout Delayed In China, Flights Canceled Due To Coronavirus - https://t.co/V1fRNazQvu",Thu Feb 27 20:26:02 +0000 2020,False,en,757240967581822977,"North Carolina, USA",2
1233086457209745409,0.9145548300619952,0.0368862313250749,0.0154251867038805,0,"5G infrastructure has the ability to emitt EMF radiation in a specific frequency and with enough power to cause symptoms that match those that are said to be caused by COVID-19, specifically flu like symptoms.",Thu Feb 27 17:48:15 +0000 2020,False,en,1097263539436236800,,0
1233084564584558592,0.2820898468010846,0.7275446050773621,0.0047777861463077,1,"There's a growing conspiracy theory making the rounds saying that COVID-19 AKA novel coronavirus is caused by 5G because Wuhan has apparently been setting up 5G infrastructure.  Even if we assume that 5G is the Boogeyman people say it is, Wuhan is also a capital city. 1/2",Thu Feb 27 17:40:44 +0000 2020,False,en,869955571784441856,"Provo, UT",1
1232967768032600069,0.1483002135439392,0.6729475453957132,0.0474413759674865,1,"The anti-#5G mobile campaigns now linking that to the Coronavirus #Covid19 outbreak (e.g. a cover up for EMF illnesses or the result of a 5G led testbed) is a new level of crazy, albeit also quite amusing 😋 . It must be make up your own conspiracy week. https://t.co/spTtnUXP5T",Thu Feb 27 09:56:37 +0000 2020,False,en,21744847,"Dorset, UK",1
1232891177357238272,0.9869829405189992,0.0378273375182794,0.006170809074663,0,"@FreedomforceR 5G  = ""Corona Virus........... It's not a Virus at all. Wuhan installed 5G. That's why people are just falling over dead. Causes acute respiratory distress,impacts oxygen in blood. And they are planning to install it all over the US. This is sick!",Thu Feb 27 04:52:17 +0000 2020,False,en,703738292290887682,United States,0
1233113975186837505,0.9824998886310896,0.0185941596659614,0.002767827039244,0,@PetiteNicoco @NM_Barbarian Coronavirus was clearly caused by 5G. #5G,Thu Feb 27 19:37:36 +0000 2020,False,en,1111093557266280448,"San Diego, CA",0
1232954121541414913,0.9290516073057684,0.0585485250450742,0.008004818303282,0,"flu-like symptoms.article reveals various connections behind the coronavirus phenomenon, including how 5G cn exacerbate or cause kind of illness you r attributing to the new virus. 5G – A Type Of Directed Energy Weapon:Total Technological Control Grid Being Rolled Out Fast.(5)",Thu Feb 27 09:02:24 +0000 2020,False,en,1060533894242541569,Mumbai India,0
1232849354366414848,0.238613418493894,0.4582450527632686,0.2108565433141421,3,"@paulbrislen I was the same until I read the Covid19 / 5G conspiracy, that was amazing &amp; I'm hooked on them now. You know those cycle cops on K Rd have 5G cell phones eh",Thu Feb 27 02:06:05 +0000 2020,False,en,38007797,Lyttelton,1
1233044053647863813,0.2338886829946777,0.8710188594048625,0.0088976351428076,1,If you think this virus just happened... why do Clorox wipes say it kills Human Coronavirus? #conspiracytheory ..No.. #5G helped this https://t.co/VUf1KRHsgt,Thu Feb 27 14:59:45 +0000 2020,False,en,1897518336,United States,1
1233078442469490688,0.7146845219549867,0.2543482792956663,0.0096749715365866,0,&gt;believes coronavirus is caused by 5G radio waves https://t.co/dRbLeXPp9V,Thu Feb 27 17:16:24 +0000 2020,False,en,1195768766216450048,United States,0
1233008972027678720,0.019679111835878,0.0054730083780498,0.9789100278168902,2,"Despite growing concerns about the stability of related supply chain caused by the coronavirus outbreak, Tang said that he believes demand for MCUs will remain strong, particularly from sectors including 5G base stations, servers and other cooling fan systems.",Thu Feb 27 12:40:21 +0000 2020,False,en,1005087587923419137,,2
1232957055033430016,0.413145382415967,0.4412319321553954,0.0438382183384115,3,"According to James Lynos-Weiler who has PhD, said about conspiracy of Corona n 5G techonolgy connection hw tht could be dangerous"" I've analyzed the entire genome sequence of this virus (Wuhan coronavirus) n compared it to the entire genome sequences of all othr coronaviruses(21)",Thu Feb 27 09:14:03 +0000 2020,False,en,1060533894242541569,Mumbai India,1
1232998681063940101,0.0102743174064922,0.988799216001194,0.0376297887052408,1,"Oh bugger, I caved and had a go at a ""5G/coronavirus map"" conspiracy theorist and now I am ducking for cover",Thu Feb 27 11:59:28 +0000 2020,False,en,18671008,"Frome, England",1
1233118740490915840,0.0421907670833844,0.0079176041033189,0.8906587833096846,2,5G Plans Face Setbacks Amid Coronavirus Spread - https://t.co/ksD7kmilgW,Thu Feb 27 19:56:32 +0000 2020,False,en,2269141116,"Williamsburg, VA",2
1233089975417262080,0.8642687962599758,0.0897874020066098,0.0179078876231702,0,"THE CLAIM STANDS AS FOLLOWS: &gt;5G infrastructure has the ability to emitt EMF radiation in a specific frequency and with enough power to cause symptoms that match those that are said to be caused by COVID-19, specifically flu like symptoms.",Thu Feb 27 18:02:14 +0000 2020,False,en,49892671,,0
1232993825729269760,0.9110428729370392,0.0441647065430648,0.0111062610880749,0,"@YouTube COVID-19 causes Acute Respiratory Disease, well that's what 60Ghz or 5G does by oscillating the Oxygen molecules in our blood just like a microwave does to water when cooking food and therefore making it difficult to attach to Haemoglobin.",Thu Feb 27 11:40:10 +0000 2020,False,en,137768787,UK,0
1232913693748260864,0.4588881883976623,0.0460460983173155,0.5552163639818041,2,Coronavirus effect is hitting the Bay Area’s tech industry hard. Here’s why https://t.co/Tmd97o9cMt via @sfchronicle chip makers have come a long way. In the 80’s you enter their clean rooms and ladies hair was falling out. Yet Verizon launching 5G proven to cause brain damage🤔,Thu Feb 27 06:21:45 +0000 2020,False,en,30162305,"Millbrae, California",0
1233005246202253312,0.2068451258053601,0.4940419017096554,0.1317006694110687,3,"UK's 5G network well within safety limits, Ofcom tests find.  Not surprising that ⁦@Facebook⁩ is the home of unfounded claim #COVID19 was caused by 5G in China 🤦🏻‍♂️ https://t.co/0nPvPSm2Vu",Thu Feb 27 12:25:33 +0000 2020,False,en,1180949170611343360,"Geelong, Australia",1
1233004508181127168,0.058880053578801,0.9088059839730922,0.0846368492695842,1,"Ooooh yeah you wanted the Q*non loons to tie 5G, coronavirus, contrails and probably why there’s always one sock missing after the laundry cycle together https://t.co/1NZkOK4zeJ",Thu Feb 27 12:22:37 +0000 2020,False,en,5959342,“We are where we are”,1
1233090136306524161,0.5139819357692531,0.1969085193331858,0.0711328987752966,0,This just in from the Costessey Information Board on Facebook: coronavirus is an international cover up for deaths caused by the rollout of 5G mobile networks https://t.co/XHNYWydVIa,Thu Feb 27 18:02:52 +0000 2020,False,en,120786862,"Norwich, UK",0
1233107131315949574,0.7375805216455152,0.0198052098777916,0.0701788030688291,0,@focusedfighting @tedcruz China created Coronavirus and they stole 5G technology,Thu Feb 27 19:10:24 +0000 2020,False,en,1219822201517506566,,0
1233166696678088704,0.6932304301350669,0.310276538100006,0.0235301174138979,0,"@YeshuasBride777 @BaghdadPostPlus @jconnor19662 I agree that 5G isn't great, but the coronavirus is infecting people in places where they don't have 5G. The virus is infecting people because it's a virus. There have been viruses throughout history, and we didn't have 5G then.",Thu Feb 27 23:07:06 +0000 2020,False,en,1218577124279443458,Canada,1
1233089972711886848,0.8665174786186084,0.2265858157452664,0.0449317662516684,0,COVID-19 IS CAUSED BY 5G! Purged by /pol/ mods edition Anonymous (ID: mZOTT5it)  02/27/20(Thu)07:53:24 No.245555823 The Coronavirus is a coverup for weaponized 5G cellular technology. EVEN /POL/ PURGES THIS INFORMATION. WHY?,Thu Feb 27 18:02:13 +0000 2020,False,en,49892671,,0
1233082250104856576,0.0031490058876675,0.0018218410206589,0.9958763513273706,2,"5G rollout in China unfazed by novel coronavirus attack https://t.co/9ScKaaibPn  China Unicom announced would complete the construction of 100,000 5G base stations with China Telecom in the 1st 1/2 of year, move on to complete 250,000 base stations nationwide in third quarter",Thu Feb 27 17:31:32 +0000 2020,False,en,117433286,New York,2
1232989832659394561,0.6541677957044979,0.6548819939960149,0.0093236161504187,3,@KatiePavlich That’s because coronavirus is not what’s killing people is 5G network look into it,Thu Feb 27 11:24:18 +0000 2020,False,en,1132024709439033344,,0
1233090663534583808,0.7057087084187967,0.2045092410687292,0.0269627103038235,0,"Right To Truth Media @opalessense 48s THE CLAIM STANDS AS FOLLOWS: 5G infrastructure has the ability to emit EMF radiation in a specific frequency &amp; w enough power 2 cause symptoms that match those that are said 2 be caused by COVID-19, specifically flu like symptoms.",Thu Feb 27 18:04:58 +0000 2020,False,en,565629301,No lists/trains/proselytizing.,0
1233070212087336961,0.6308228256817073,0.1025526599304845,0.1524722777808054,0,@ungerbn103 The coronavirus was man created and unleashed as a genocide.  We are already in a civil war in case no one has noticed on all your 4g and 5g KILLING machines.  Jesus is the ONLY way the truth and the life. PERIOD demons run this Earth.,Thu Feb 27 16:43:42 +0000 2020,False,en,994294734377152514,"Castle Rock, CO",0
1233064273552826369,0.0188941525928833,0.0039019739520834,0.9876171303039938,2,"Chinese telecom operators and internet companies are ramping up efforts to explore new opportunities for #5G promotion, and their efforts will push forward the country's 5G commercialization despite stress caused by #COVID19 empidemic. https://t.co/PbVS6yrZ7q https://t.co/3ChQvAKdhJ",Thu Feb 27 16:20:06 +0000 2020,False,en,49616273,"Beijing, China",2
1233098252800552960,0.029306050413743,0.9497613327697064,0.0363982575256296,1,@tornadosis06 I just saw a schizophrenic conspiracy theorist relate coronavirus to being manufactured by the one world government and inflicted by 5G and big telecom.,Thu Feb 27 18:35:07 +0000 2020,False,en,1148640360,,1
1233146452773228545,0.9349367294421246,0.108958200848171,0.0134083724072591,0,https://t.co/vFcWiTriz3 #coronavirus was always planned to happen. To be released..to kill the population etc. They never do anything unless it was MADE to happen. #CreateReactionSolution because we are run by zombies.. #wuhan400 #5G was first tested in #wuhan also so you decide.,Thu Feb 27 21:46:39 +0000 2020,False,en,23133818,In burning 🔥hell.,0
1232951755325034498,0.0774901610077575,0.9602064176793884,0.0146119782263875,1,Hesitate to share this but guess no-one following me is likely to catch the disinformation virus and believe COVID-19 linked to 5G. Shout out to @Sander_vdLinden on conspiracy theories https://t.co/vNetX9BGI7,Thu Feb 27 08:53:00 +0000 2020,False,en,1474912213,,1
1233067852623687680,0.9415446884582316,0.0101155579824492,0.0248982107650696,0,Corona Virus is really 5G 'messing' with us apparently. https://t.co/W1n02nFINe,Thu Feb 27 16:34:20 +0000 2020,False,en,935079461300719616,,0
1232953959096020992,0.7524432724609437,0.174448335052453,0.0232688948884631,0,"be4 the coronavirus outbreak began.The coronavirus 5G connection goes very deep, getting into NWO agendas such as mandatory vaccines, depopulation and transhumanism via DNA vaccines. Meanwhile, many scientific documents on the health effects of 5G have verified that it causes(4)",Thu Feb 27 09:01:45 +0000 2020,False,en,1060533894242541569,Mumbai India,0
1232999136384995331,0.3629462064578029,0.1926865052967739,0.3259581638388627,3,"Now, that's the spirit! @ChinaUnicomGlob @chinateleglobal 💪#5G #China #covid19 #coronavirus https://t.co/IoKSFcBVGU",Thu Feb 27 12:01:16 +0000 2020,False,en,922627060559839232,,2
1233166350673010688,0.9787901946688377,0.0175979331308765,0.0069026888153938,0,Coronavirus is a coverup of the deadly test for the 5g rollout in Wuhan. https://t.co/ZIdZFYKIyJ,Thu Feb 27 23:05:43 +0000 2020,False,en,1157818932205461504,,0
1233075447623233539,0.8047179087841032,0.206806907066368,0.021978515158575,0,"@Bryson_M Coronavirus isn't even that bad, it was just made to cover up illnesses caused by 5G (according to random internet person)",Thu Feb 27 17:04:30 +0000 2020,False,en,15042976,United Kingdom,0
1232860227873234944,0.068437753183439,0.7773643707036715,0.0748118603778031,1,"@BullyEsq Sir, I have a conspiracy for you, the cause of the coronavirus is the 5g internet",Thu Feb 27 02:49:18 +0000 2020,False,en,296975141,,1
1233144014762913797,0.0739142392469877,0.9685106386250424,0.0142312910621794,1,Are 5G and Coronavirus connected? Is @BillGates behind it all? It's good to practice healthy skepticism but this resonates with my inner conspiracy theorist.  https://t.co/O9wWT0uCbr,Thu Feb 27 21:36:58 +0000 2020,False,en,1079590331513884672,The Mile High City,1
1232956647514918912,0.8168192833706305,0.0574917241248093,0.0751125687456403,0,"only to hand over tht research to the US after losing World War 2). The evidence tht COVID-19 is a bioweapon is overwhelming – n so is the evidence that 5G is involved to either cause flu-like symptoms/pneumonia people hv bn experiencing, and/or to exacerbate the virulity of (19)",Thu Feb 27 09:12:26 +0000 2020,False,en,1060533894242541569,Mumbai India,0
1233144423946563584,0.9910310558591036,0.0009574418676392,0.134069788629414,0,"@true_pundit @UnitedSaintsAm China's people are vulnerable.  Because of the terrible pollution, they are compromised in their lungs.  Also this particular Coronavirus attacks the Asian lung in a particular way.  Add to this the rollout of 5G in WuHan had another physical impact on citizens.  Bad stuff.",Thu Feb 27 21:38:36 +0000 2020,False,en,917022784395599872,,0
1233165438915416069,0.5707693670826709,0.3289794051482268,0.0405950630632521,0,@YeshuasBride777 @BaghdadPostPlus @jconnor19662 Or maybe countries with 5g are also richer and more connected but sure thing 5g causes coronavirus. I guess they shouldn't use a vaccine to treat this either right?,Thu Feb 27 23:02:06 +0000 2020,False,en,1035929937130278912,"Enniskillen, Northern Ireland",0
